aid;nombre_atractivo;descripcion_atractivo;url_atractivo
161;ALGAIDA-SALINA PINAR DESAMPARADOS;Impedit suscipit rerum culpa veniam aspernatur repellendus nobis. Ea tempora voluptatibus exercitationem dolorum cum totam a. Facilis velit dicta iste voluptas fugit explicabo ad.;http://lorempixel.com/337/244/nature/
162;BORNOS DEL DE;Saepe dolorem officia quaerat culpa. Consequatur incidunt praesentium numquam perferendis natus.;http://lorempixel.com/336/217/nature/
163;SETENIL LA LOS;Facere hic in quos. Tenetur fugit natus tempora.;http://lorempixel.com/226/254/nature/
164;DEL BARBATE DEL;Laboriosam officiis fugiat saepe voluptatum qui. Quaerat suscipit sapiente sapiente ducimus. Praesentium aliquid qui esse quo quisquam distinctio.;http://lorempixel.com/311/300/nature/
165;VÍA VERDE LA;Veniam officiis suscipit ut eum ratione. Fuga in consequuntur ducimus. Voluptatibus veritatis officia error ea dolorem.;http://lorempixel.com/232/231/nature/
166;GARCIAGO DE PEÑA;Voluptatum cumque beatae. Harum alias possimus reprehenderit mollitia. Occaecati id ullam.;http://lorempixel.com/380/224/nature/
167;CALLEJÓN - DE;Culpa ea soluta quibusdam.;http://lorempixel.com/361/300/nature/
168;LA MIEL PICO;Architecto error odit rem sint. Perspiciatis quas provident esse ex.;http://lorempixel.com/308/245/nature/
169;TEJÓN LAS LAGUNAS;Ducimus tenetur voluptate neque voluptas est. Similique sapiente hic nemo assumenda.;http://lorempixel.com/259/219/nature/
170;RATÓN JEREZ FRONTERA;Voluptatibus voluptate temporibus vitae.;http://lorempixel.com/309/400/nature/
171;LA DE ROMANA;Perferendis sit culpa culpa libero aut. Dolorum alias magnam illo ea eligendi.;http://lorempixel.com/201/262/nature/
172;PLAZA ARMAS ROMANOS;Harum beatae sint voluptates reiciendis iusto illum libero. Corrupti quaerat possimus nobis.;http://lorempixel.com/209/298/nature/
173;LADERA CÁMARA LOMAS;Corrupti porro cupiditate perspiciatis. Praesentium adipisci reiciendis saepe ipsam id.;http://lorempixel.com/263/273/nature/
174;CAÑADA CORDERO DE;Eum modi nemo sunt ullam necessitatibus nostrum. Quos provident perferendis a voluptatum id. Non eum dolore voluptate necessitatibus.;http://lorempixel.com/397/252/nature/
175;"CHICA ""LAGUNAS CÁDIZ";Quisquam voluptates qui perspiciatis occaecati excepturi beatae. Voluptas praesentium natus voluptate ipsam mollitia sint.;http://lorempixel.com/308/395/nature/
176;RINCONCILLO DUNAS DEL;Veniam sed consectetur magni odio ut. At optio ab amet voluptatibus quisquam esse. Facere tempore molestias nulla alias.;http://lorempixel.com/329/232/nature/
177;TOLETA LA CALZADA;Fugiat quaerat ducimus magnam. Rem doloremque blanditiis praesentium fugit neque. Accusantium ducimus ab occaecati tenetur.;http://lorempixel.com/369/307/nature/
178;PRESA EMBALSE A;Iure commodi similique rem commodi nemo rerum.;http://lorempixel.com/380/328/nature/
179;DE FUENTES FRANCESES;Corporis ducimus magni animi vero perferendis. Perspiciatis nihil quasi sit corporis.;http://lorempixel.com/298/247/nature/
180;DE DEL MARISMAS;Iure reprehenderit repellendus iusto consectetur sit nihil. Similique officiis totam deleniti officia.;http://lorempixel.com/208/257/nature/
181;CAÑILLO REGINOSA DE;Similique ab nihil atque esse nam consectetur nisi.;http://lorempixel.com/309/219/nature/
182;MEDINA ROMANOS SALTILLO;Voluptas officia quaerat natus. Tempora voluptatibus quia ratione deleniti.;http://lorempixel.com/365/304/nature/
183;DE CAMINO TESORILLO;Fugit quis exercitationem aperiam. Totam laudantium totam voluptatibus rerum. Similique corporis modi recusandae inventore iusto nemo.;http://lorempixel.com/313/224/nature/
184;LOS FORESTAL LANCES;Iure perferendis iste animi. Quae deserunt atque quae quia necessitatibus impedit.;http://lorempixel.com/280/220/nature/
185;DEL AZÚCAR EL;Eaque incidunt voluptatibus quam. Quaerat quas officiis perferendis. Corporis ratione esse inventore praesentium. Asperiores facere perspiciatis mollitia voluptate nam totam.;http://lorempixel.com/284/394/nature/
186;SUARA LA PINOS;Ad iure eveniet. Neque eligendi eveniet nemo.;http://lorempixel.com/326/361/nature/
187;TESORILLO LA PEDRIZA;Quae dolorem omnis. Cumque repellendus enim numquam. Amet nihil nostrum sequi qui quam.;http://lorempixel.com/248/281/nature/
188;SALINAS DOLORES PALANCAR;Sit nulla nam adipisci natus odio magni debitis. Asperiores provident repudiandae totam ad. Eveniet dignissimos magni modi explicabo odit laudantium.;http://lorempixel.com/233/262/nature/
189;DEL FUENTES TAJO;Porro accusamus laborum. Eos ut consequatur perferendis fugit assumenda repellat.;http://lorempixel.com/231/264/nature/
190;A TEJÓN CANTERAS;Recusandae veritatis velit vitae quos quas.;http://lorempixel.com/314/231/nature/
191;SANLÚCAR ANTÓN BARRAMEDA;Ex culpa dignissimos eligendi facilis in fugit nostrum. Tempore culpa est fuga.;http://lorempixel.com/221/329/nature/
192;LOMAS RURALES ROTA;Voluptate voluptatum harum facere. Necessitatibus tempora at neque delectus quod perferendis. Quidem voluptate similique fugit animi eveniet ex corrupti.;http://lorempixel.com/247/238/nature/
193;DE TRAMO CORREDOR;Quia nesciunt animi doloribus nisi harum. Rem voluptatibus quod maiores omnis non.;http://lorempixel.com/260/356/nature/
194;NACIMIENTOS ARMAS LA;Aut similique numquam omnis fugiat natus iste quam.;http://lorempixel.com/345/207/nature/
195;DE VÍA LA;Laborum at optio deleniti et vero. Minima pariatur iusto blanditiis veniam deserunt. Porro voluptatem sed debitis esse exercitationem.;http://lorempixel.com/302/233/nature/
196;TRAFALGAR-CONIL ARROYOMOLINOS LA;Beatae doloribus saepe facere.;http://lorempixel.com/378/230/nature/
197;REGINOSA EMBALSE DE;Alias suscipit praesentium vero aperiam incidunt. Ducimus optio quis.;http://lorempixel.com/340/223/nature/
198;Y LAS EL;Velit ab quae esse id ratione. Non minima eum atque vel voluptas.;http://lorempixel.com/362/345/nature/
199;MARISMAS Y DE;Pariatur debitis consequuntur. Accusamus architecto eum officiis ea fuga dicta. Dolor quibusdam mollitia quasi nam.;http://lorempixel.com/203/259/nature/
200;ALGARBES-BETIJUELO LOS ALBINA;Illo deserunt nobis maxime enim. Nulla iste eveniet repudiandae esse vero quod.;http://lorempixel.com/218/398/nature/
201;LOS PINAR TAPA;Delectus molestias necessitatibus sunt nemo dolore. Magni maiores possimus aut.;http://lorempixel.com/254/388/nature/
202;BOLONIA-PULIDO DE PLATERAS;Beatae ipsa nihil veniam.;http://lorempixel.com/323/366/nature/
203;VERDE CORREDOR IV;At sapiente cumque. Vitae modi commodi. Itaque accusamus quam facere.;http://lorempixel.com/379/276/nature/
204;GARCIAGO AL VERDUGO;Reprehenderit voluptatum quasi libero voluptates autem. Quas nihil quisquam eum illo. Qui nam perferendis quae in minus cupiditate. Sequi numquam sed facilis molestiae dolorem.;http://lorempixel.com/255/311/nature/
205;EMBALSE DEL BORNOS;Ut nemo praesentium quibusdam dolores quia. Et molestias commodi ratione earum. Nostrum nam esse facilis vel fugiat.;http://lorempixel.com/371/241/nature/
245;DE ALGARBES-BETIJUELO GARCIAGO;Modi impedit commodi eum. Est soluta quod fugit fuga officia sequi. Neque est maxime voluptas veniam harum.;http://lorempixel.com/257/399/nature/
206;TESORILLO TAJO TORRE;Dolorem labore delectus recusandae voluptates quod magnam tempora. Optio officiis rem occaecati. Velit nulla neque ducimus corporis distinctio atque.;http://lorempixel.com/360/363/nature/
207;LA DE JIMENA;Expedita harum ducimus harum ab consectetur mollitia ex. Labore qui cum dolorum explicabo fuga distinctio tempora. Ducimus architecto quam ullam quos itaque asperiores.;http://lorempixel.com/232/213/nature/
208;RINCONCILLO DEL CHICLANA;Possimus quis enim hic iure. Animi corrupti harum animi quod.;http://lorempixel.com/207/283/nature/
209;AL DE ALJIBE;Soluta cum placeat. Debitis atque consequuntur odit eius. Explicabo dolorem itaque quam sint.;http://lorempixel.com/320/243/nature/
210;ROMANOS LOS AL;Blanditiis dolorem in rem laboriosam. Suscipit odit inventore enim facilis hic consequatur cum.;http://lorempixel.com/252/302/nature/
211;ROCHE DE DE;Tempora eum aut eius explicabo nam officia. Vero officiis dolorem quis voluptate fugit. Nobis vitae ad dolorum similique. Fugit quod beatae quisquam eius.;http://lorempixel.com/338/329/nature/
212;LOS BATANES DEL;Vitae veritatis nam doloribus praesentium beatae neque. Enim numquam harum et eius. Placeat autem qui cupiditate optio.;http://lorempixel.com/221/307/nature/
213;DE BARRAMEDA PUERTA;Omnis non eos eaque mollitia laborum. Saepe neque sint autem.;http://lorempixel.com/314/269/nature/
214;RÍO MIEL LA;Eius fugit eveniet libero sequi laboriosam in corrupti. Voluptatum eveniet eos praesentium asperiores.;http://lorempixel.com/282/208/nature/
215;CALAS HOZGARGANTA CONIL;Quas animi placeat deserunt sit sint eos. Illum tempore illum optio nihil voluptatum nihil occaecati.;http://lorempixel.com/251/353/nature/
216;CRUZ DE DE;Ipsa dignissimos culpa modi laboriosam quas quam. Voluptatem itaque cum molestias architecto eligendi impedit. Labore nemo ullam inventore quia magnam saepe.;http://lorempixel.com/316/327/nature/
217;SUBIDA ERMITA Y;Dolor aliquid non. Quod odit alias est. Consequatur recusandae architecto doloremque tempore.;http://lorempixel.com/311/400/nature/
218;DE LOS MONTE;Aperiam exercitationem doloremque perspiciatis ea voluptatibus. Enim sint ipsa facilis eaque vero.;http://lorempixel.com/209/331/nature/
219;CASA DE BORNOS;Incidunt error voluptatibus voluptatem. Tempora deleniti aliquid ut.;http://lorempixel.com/258/274/nature/
220;LÍBAR ALGARBES-BETIJUELO LOS;Tempora amet accusantium sit nobis fugit suscipit. Inventore at odio quae accusamus expedita libero. Nostrum aliquid itaque expedita eligendi aliquam cupiditate id. Quae modi consequuntur.;http://lorempixel.com/301/332/nature/
221;DE HOZGARGANTA RÍO;Qui quod fuga recusandae sequi atque. Voluptatum ipsam velit et maiores. Voluptatibus sequi perferendis.;http://lorempixel.com/385/358/nature/
222;DE EL LOS;Doloribus magnam magni molestiae temporibus qui. Velit aut aliquid expedita facilis. Dolore harum quidem recusandae porro veniam.;http://lorempixel.com/283/381/nature/
223;DEL LA PAPA;Optio optio ullam fugit quod inventore. Facere cupiditate possimus natus adipisci facere eligendi.;http://lorempixel.com/205/334/nature/
224;VIEJAS DE DE;Velit aspernatur quo tempora in. Quae accusamus aperiam nemo blanditiis repudiandae ullam.;http://lorempixel.com/281/223/nature/
225;COLA DE EMBALSE;Recusandae dolorum occaecati quasi earum. Placeat numquam rem magnam.;http://lorempixel.com/204/304/nature/
226;LA BOYAL- SUARA;Perferendis aliquam laboriosam incidunt nesciunt soluta. Placeat harum voluptatem minima corrupti. Dolor earum eius.;http://lorempixel.com/348/253/nature/
227;LITORAL DE ROTA;Recusandae tenetur praesentium quidem at.;http://lorempixel.com/253/376/nature/
228;LA DOS BAHÍAS;Nostrum sint nisi eos.;http://lorempixel.com/245/269/nature/
229;LA DE DE;Ipsam cupiditate omnis voluptatem veniam perspiciatis harum. Amet quo dignissimos neque deleniti corrupti. Architecto a error similique quam.;http://lorempixel.com/214/384/nature/
230;DEL LAS TEJÓN;Aliquid esse cum voluptatem sequi ad. Suscipit sed accusamus magni molestias laudantium atque nostrum.;http://lorempixel.com/353/336/nature/
231;LA CALZADA DEHESA;Deserunt facere consequuntur veniam itaque animi omnis provident. Aliquam labore possimus cum totam voluptates dolorum. Distinctio veritatis aliquid quisquam vitae porro tempore.;http://lorempixel.com/321/214/nature/
232;CALVARIO ACANTILADO DEL;Voluptatum distinctio natus aperiam dignissimos quod nulla. Nostrum saepe laborum exercitationem at occaecati.;http://lorempixel.com/344/399/nature/
233;CHARCO PLAYA BARROSA;Optio beatae dicta libero optio similique sint. Nostrum dolore eum quod praesentium.;http://lorempixel.com/230/249/nature/
234;LA FRONTERA-CANTARRANAS LA;Reprehenderit harum officia hic voluptatem perferendis vel. Sunt ipsum nesciunt fuga eveniet quo amet amet. Nostrum corrupti necessitatibus cupiditate odio numquam.;http://lorempixel.com/224/372/nature/
235;Y LA ERMITA;Animi quisquam similique nam ut quae doloribus. Explicabo est ut praesentium. Dolorem dolorum quis incidunt consequatur.;http://lorempixel.com/394/222/nature/
236;DEL DE PUERTO;Tempore similique quo hic. Quasi autem porro eaque vel.;http://lorempixel.com/208/275/nature/
237;GUADALETE A REAL;Dolore odio ipsa doloribus animi ipsum. Facilis itaque pariatur quisquam ex enim atque iure.;http://lorempixel.com/313/252/nature/
238;AL AL HONDO;Deleniti nemo fuga soluta sint odio vitae. Totam hic aspernatur blanditiis provident distinctio quo. Laboriosam ex repudiandae praesentium.;http://lorempixel.com/309/237/nature/
239;EL CAÑILLO SALTILLO;Accusantium fugiat consequuntur et hic ipsum. Nemo necessitatibus iste soluta laudantium alias. Laborum voluptatem enim omnis laboriosam. Libero vero ab ipsa doloribus sapiente blanditiis.;http://lorempixel.com/365/347/nature/
240;VERDE MILLAN GARGANTA;Qui assumenda illo provident tenetur maiores. Autem asperiores repellendus animi voluptatum ipsum.;http://lorempixel.com/244/340/nature/
241;VENTA DEL VEREDA;Rerum fugit maxime debitis a ipsa. Labore sit quibusdam qui hic debitis.;http://lorempixel.com/369/331/nature/
242;TORRE GARGANTE LA;Nobis odio perferendis sunt rerum. Aliquid adipisci hic provident. Voluptate ea excepturi placeat. Consequatur est laudantium.;http://lorempixel.com/340/351/nature/
243;VALDEINFIERNO LOS ALGARBES-BETIJUELO;Sed rerum et quos unde. Dolorem quidem nostrum deserunt cum soluta.;http://lorempixel.com/358/314/nature/
244;DE DEL ALGAMASILLA;Ullam facilis voluptatibus nam. Tenetur beatae sequi. Deleniti officiis laudantium rem accusantium.;http://lorempixel.com/305/318/nature/
246;CALZADA FRONTERIZO BOYAL;Tempora quia corporis iusto occaecati. Reiciendis molestiae dolor exercitationem eaque odit. Corporis repellat dicta eum.;http://lorempixel.com/225/369/nature/
247;LITORAL ALTO DEL;Totam sed beatae. Est laborum beatae saepe non sed voluptatum. Repellat beatae rem nostrum dolores illum. Et molestiae atque.;http://lorempixel.com/315/374/nature/
248;ALGARBES-BETIJUELO CABRERO DEL;Eligendi modi dolores recusandae. Quisquam ab hic non. Illo nobis dicta occaecati ut facilis.;http://lorempixel.com/299/334/nature/
249;VEREDA LA DE;Corrupti reprehenderit at. Sed nostrum qui tenetur ullam ipsam. Animi nihil suscipit optio consequuntur.;http://lorempixel.com/223/318/nature/
250;CERRO AL SUBIDA;Dolor consequatur laudantium deleniti praesentium voluptate sint.;http://lorempixel.com/256/280/nature/
251;CERRO ALBARRACINEJO SUBIDA;Quis animi laudantium officiis. Nisi ex sint esse. Pariatur corporis dolore quas repellat.;http://lorempixel.com/203/397/nature/
252;ARROYO ALGAMASILLA DEL;Iusto labore incidunt optio veniam esse rerum. Inventore tenetur beatae quibusdam enim officia ducimus. Natus voluptate incidunt.;http://lorempixel.com/241/283/nature/
253;QUINTAS VERDE DE;Ducimus dolorem minus doloribus perferendis. Magnam quaerat tempore amet ipsam id at placeat. Amet quis veniam quaerat.;http://lorempixel.com/295/397/nature/
254;PUERTO ARCOS MARÍA;Dolor occaecati ipsum nesciunt. Amet nostrum at maxime architecto corporis labore. Voluptates dolor maiores veniam nihil aperiam facere.;http://lorempixel.com/342/256/nature/
255;PINSAPAR DE EL;Mollitia quibusdam deleniti. Voluptatibus molestiae recusandae voluptatibus sint.;http://lorempixel.com/398/223/nature/
256;RIO DEL MAJACEITE;Suscipit eos repudiandae. Sapiente repellat sapiente porro nisi modi officiis.;http://lorempixel.com/250/238/nature/
257;LA ROMANA DE;Corrupti quisquam laborum excepturi. Dolorem nisi libero laboriosam quam recusandae. Voluptatem rerum expedita tempore.;http://lorempixel.com/316/296/nature/
258;DEL DE TORREÓN;Ipsam eum autem. Nobis deleniti delectus fuga. Error culpa veniam ullam autem accusamus repudiandae ex.;http://lorempixel.com/294/207/nature/
259;GUAREÑAS - ROJITAN;Odit doloremque nesciunt occaecati aspernatur. Mollitia deserunt beatae laudantium. Fugiat quis alias similique ipsa expedita.;http://lorempixel.com/260/309/nature/
260;LA ROCHE CALAS;Quae ab animi. Distinctio quasi et voluptatem. Magnam hic excepturi facere.;http://lorempixel.com/315/351/nature/
261;CABRERO DEL UBRIQUE;Nesciunt fuga dolor sed. Veniam nesciunt nam est ut voluptate veritatis.;http://lorempixel.com/287/384/nature/
262;MOGOTE DE REAL;Consectetur iure tenetur. Quis odio culpa architecto at odit. Id at atque.;http://lorempixel.com/291/395/nature/
263;DE DE TAJO;Quis corrupti delectus consequatur animi modi non. Necessitatibus ad expedita tempore natus ea cumque.;http://lorempixel.com/323/334/nature/
264;GIGONZA PILAR DEL;Fugiat odio nihil accusantium. Alias voluptate alias nulla velit deleniti atque. Labore autem voluptate quidem voluptas quibusdam.;http://lorempixel.com/381/358/nature/
265;ALJIBE DEL ALGAIDA;Ut fuga eaque dolor. Doloribus possimus veritatis at molestiae. Minima recusandae fuga quod amet voluptatem harum.;http://lorempixel.com/378/330/nature/
266;DE TRAFALGAR-CONIL MECA;Quos similique tempore expedita nesciunt quam. Officia accusamus recusandae vero voluptate laboriosam. Quasi optio reprehenderit hic.;http://lorempixel.com/250/231/nature/
267;DE COLADA DE;Quo assumenda placeat recusandae. Similique at quisquam nisi eaque. Expedita hic laudantium officiis distinctio.;http://lorempixel.com/345/330/nature/
268;- ARROYOMOLINOS GASTOR;Labore amet illum.;http://lorempixel.com/206/274/nature/
269;CARISSA AURELIA GUADALETE;Quaerat rerum accusantium eveniet. Praesentium quo temporibus sunt ipsam vel necessitatibus.;http://lorempixel.com/336/327/nature/
270;VERDE PUERTO DEL;Cum enim exercitationem natus voluptas ut laborum. Deleniti cum tempore consectetur assumenda. Recusandae eos commodi explicabo nemo officiis.;http://lorempixel.com/258/276/nature/
271;DE GUADALETE ROCHE;Similique praesentium reiciendis repellendus nihil. Pariatur nisi maiores.;http://lorempixel.com/312/242/nature/
272;TAJO DE LOS;Laudantium ut rerum iste dolore. Recusandae quos recusandae totam.;http://lorempixel.com/336/300/nature/
273;ROMANA DEL LA;Repellendus vel quibusdam nesciunt nostrum vero. Adipisci aut nesciunt quae consectetur. Unde doloribus temporibus animi deleniti aspernatur vel.;http://lorempixel.com/336/387/nature/
274;LÍNEA SAN VERDE;Non unde inventore esse aspernatur eum velit officiis. Harum tempora pariatur soluta enim.;http://lorempixel.com/317/212/nature/
275;CERRO TOLLOS DEL;Laborum aliquam incidunt nulla neque sint repellat. Quas eveniet expedita magni. Aut numquam perspiciatis ea.;http://lorempixel.com/348/249/nature/
276;SILLA CALZADA SUBIDA;Fugit a earum repudiandae corrupti reiciendis. Expedita quae natus nemo laborum voluptas. Aliquid dolores sint enim voluptates facere nemo.;http://lorempixel.com/392/345/nature/
277;ARROYO DESCANSADERO RAYO;Eveniet ad omnis adipisci iure nam inventore. Harum rem nihil aliquid sequi maxime iusto aut. Accusamus omnis quo natus.;http://lorempixel.com/365/323/nature/
278;DEL ZONA REY;Totam occaecati aut dolorum similique at voluptas. Quos animi neque nostrum voluptates. Incidunt esse rerum officia exercitationem eaque.;http://lorempixel.com/303/245/nature/
279;GUADALMESÍ AL ALBARRACINEJO;Quod nesciunt quos iure. Non iste temporibus quaerat culpa aperiam. Eaque cumque cumque nobis eveniet voluptatem iste saepe.;http://lorempixel.com/373/274/nature/
280;MARISMAS DE DEL;Consequatur voluptatem alias velit vero voluptatem voluptatibus. Repellendus nisi asperiores consequatur aspernatur totam quia enim. Cumque unde explicabo unde.;http://lorempixel.com/200/390/nature/
281;BARBATE DE CARBONEROS;Ab adipisci optio consectetur cum assumenda cupiditate ex. A iusto iusto autem sed illo. Quo animi fugit.;http://lorempixel.com/215/302/nature/
282;CABRERO DEL SALTO;Impedit nostrum corporis illum. Eligendi eius eaque laudantium distinctio eius. Cum sint harum.;http://lorempixel.com/200/267/nature/
283;DEL DE ESTUARIO;Nesciunt id vero voluptatum animi quos. Ipsa libero quia animi pariatur. Eaque delectus maiores nihil a ea. Porro odio repellat eveniet tempora.;http://lorempixel.com/216/366/nature/
284;DE BARBECHOS GUAREÑAS;Natus quos reiciendis error fugiat dolorem quae. Possimus cumque rerum nihil sint deserunt.;http://lorempixel.com/335/286/nature/
285;VERDE MARÍA PUERTO;Accusamus necessitatibus provident dolores atque aperiam quibusdam voluptatibus. Itaque optio illum modi rem. Dolorem maxime dicta atque id nesciunt nihil.;http://lorempixel.com/269/347/nature/
286;MOCITAS CALLEJÓN LAS;Quaerat necessitatibus ex at repellendus voluptas. Itaque minus impedit consequatur numquam recusandae. At est deserunt eveniet voluptatibus odit rem distinctio.;http://lorempixel.com/233/388/nature/
287;CAOS VILLALUENGA-NAVAZOS DE;Magni possimus est repudiandae aliquid. Dignissimos impedit soluta adipisci dolorem commodi voluptate. Quis dolores tempora provident ipsam.;http://lorempixel.com/234/342/nature/
288;ALGODONALES ALBINA LA;Rem ullam asperiores aspernatur facilis. Temporibus culpa odit fuga aliquid libero.;http://lorempixel.com/327/205/nature/
289;CHARCONES ALMORAIMA LOS;Sint quae doloribus minus earum quo suscipit. Omnis at rem reprehenderit expedita.;http://lorempixel.com/304/245/nature/
290;DE DE MONTECOCHE;Blanditiis cumque facere rem optio alias ut. Minima quod maiores illum. Quibusdam neque voluptas eum porro voluptatem.;http://lorempixel.com/271/354/nature/
291;ERA CAMINO GUADIARO;Possimus cum vel perspiciatis. Excepturi eaque optio. Explicabo quaerat facilis.;http://lorempixel.com/341/236/nature/
292;FORESTAL DE MEDINA;Molestiae dignissimos magnam atque ad. Recusandae voluptatibus fugiat aspernatur qui error eaque.;http://lorempixel.com/240/360/nature/
293;DE VENTA DE;Labore unde occaecati rem. Amet aliquam ullam voluptates voluptate. Illo aliquam consectetur ab eum exercitationem.;http://lorempixel.com/311/339/nature/
294;TOLLOS CARRASCÓN LAGUNA;Ut maxime laborum hic. Cupiditate consequuntur dicta veniam neque molestias.;http://lorempixel.com/351/248/nature/
295;DEL MOJÓN LA;Accusamus sint voluptatibus provident alias. Assumenda rerum repudiandae quidem tempora iusto. Ex similique voluptates modi.;http://lorempixel.com/280/243/nature/
296;A DE CARNERO;Veniam quam molestias. Ipsa veritatis optio temporibus atque. Voluptas saepe expedita sunt quasi officia eos.;http://lorempixel.com/317/315/nature/
297;CAMPOBUCHE DE BOLONIA-PULIDO;Laborum laudantium voluptatem dolor facere ducimus porro. Ipsa dicta deserunt cupiditate. At mollitia eius magnam facere eius numquam est.;http://lorempixel.com/207/298/nature/
298;DE FRESNILLO SUBIDA;Officia ratione a ipsam. Provident reiciendis cupiditate eum delectus labore beatae. Sed iste minus voluptatum expedita ratione.;http://lorempixel.com/316/395/nature/
299;FERNANDO SAN -;Ipsa animi impedit at facilis. Fuga officiis corrupti veniam. Pariatur sunt quasi provident laborum voluptates non.;http://lorempixel.com/400/356/nature/
300;CAOS CALZADA ROMANA;Facere aliquam earum rem. Maxime repudiandae voluptatum odio vero. Dolore in voluptatibus magnam nostrum.;http://lorempixel.com/259/259/nature/
301;DE ANTIGUA LA;Non maiores praesentium esse repellat repellat. Voluptatem placeat minus illum occaecati.;http://lorempixel.com/356/355/nature/
302;DE LAGUNA LA;Sint ipsum voluptatibus ducimus. Mollitia voluptatem iure sapiente provident inventore.;http://lorempixel.com/311/251/nature/
303;LAS REY DEL;Eum excepturi optio eligendi minus explicabo.;http://lorempixel.com/323/342/nature/
304;HIGUERÓN RISCO DE;Nisi consequuntur blanditiis eum harum ipsam odio. Placeat natus officiis commodi modi modi. Qui ipsa tempora rerum commodi reprehenderit.;http://lorempixel.com/325/339/nature/
305;LA PINAR DE;Necessitatibus cumque doloremque vero ut assumenda. Doloremque explicabo repellat similique dignissimos nam similique.;http://lorempixel.com/399/292/nature/
306;DEL ALBERITE PAPA;Qui minus placeat adipisci optio eos quibusdam iste. Autem reiciendis aut modi aliquam. Id possimus provident id officia quasi nostrum.;http://lorempixel.com/292/349/nature/
307;OJO DEL GRULLO;Et modi nulla dolore magnam itaque. Quo harum sit sequi nemo.;http://lorempixel.com/372/368/nature/
308;RÍO DE MIEL;Delectus qui illum accusamus quis earum maiores amet. Recusandae eos odit delectus assumenda voluptatem necessitatibus.;http://lorempixel.com/318/245/nature/
309;RUINAS ALGAIDA-SALINA ESPERILLA;Consectetur culpa optio aliquid doloribus dolorem quasi. Nulla sunt saepe unde consequatur eveniet dolores. Modi quaerat dolor quidem voluptates molestiae odio.;http://lorempixel.com/390/320/nature/
310;SILLETERO DE FARDELA;Ratione ipsa libero reiciendis nostrum iste. Error harum delectus.;http://lorempixel.com/393/398/nature/
311;DE ANTONIO LA;Voluptas eum tenetur dicta esse doloribus eum. A id ratione soluta est fugiat consectetur.;http://lorempixel.com/318/221/nature/
312;DE TESORILLO BREÑA;Unde dignissimos distinctio dicta. Neque aspernatur nam natus. Dignissimos provident labore deserunt commodi id mollitia.;http://lorempixel.com/317/292/nature/
313;VERDE COVEZUELAS-CHARCA DE;Nulla ipsa id commodi iste necessitatibus. Commodi unde nostrum sequi. Alias eligendi consequatur quas incidunt nisi sit.;http://lorempixel.com/301/247/nature/
314;EL DE BOSQUE;Illo nisi sapiente quibusdam eligendi ad accusamus. Quam cumque soluta.;http://lorempixel.com/207/379/nature/