aid;nombre_atractivo;descripcion_atractivo;url_atractivo
0;VIAJE DE UN;Commodi quis explicabo magni quae eveniet. Dolore consequatur necessitatibus optio eos nostrum. Error ex dolorum architecto dolores numquam.;http://lorempixel.com/265/295/nature/
1;LA ALBINAS TEJA;Voluptate facere harum. Eius eius voluptates praesentium. Possimus reiciendis omnis quos.;http://lorempixel.com/310/313/nature/
2;A RONDA ALGAIDA;Repellendus nostrum eaque deserunt neque debitis. Cum praesentium delectus repudiandae officia. Dolore exercitationem sit nihil error.;http://lorempixel.com/301/286/nature/
3;DE FUENTE RAMOS;Illo natus hic autem accusamus. Amet consequatur fuga sequi reiciendis aliquam. Eveniet animi veritatis blanditiis voluptas eius optio.;http://lorempixel.com/287/343/nature/
4;PUERTA DE CHICLANA;Suscipit ex sunt tempora.;http://lorempixel.com/331/377/nature/
5;RURALES FUENTES DE;Omnis eius quam perspiciatis ad. Dolore excepturi fugit soluta. Officiis eius vel quod dolorem itaque suscipit. Sequi corrupti nemo suscipit quae consequatur minus.;http://lorempixel.com/394/313/nature/
6;FRONTERIZO FUENTE RAMOS;Omnis quidem dolorum. Iure sequi corrupti nemo.;http://lorempixel.com/251/211/nature/
7;DE CORDERO TAJO;Ducimus et possimus ipsum sunt. Hic pariatur ullam corrupti dolores. Iste praesentium perspiciatis labore. Eligendi saepe blanditiis sint repellat a.;http://lorempixel.com/353/324/nature/
8;ARILLO - VERDE;Doloribus omnis cupiditate. Quisquam ex doloribus vitae aperiam natus animi.;http://lorempixel.com/320/319/nature/
9;EL BOLONIA-PULIDO TREN;Aperiam perspiciatis qui ut nesciunt. Dicta placeat voluptatum quo repellendus quos unde. Laborum nihil blanditiis incidunt unde.;http://lorempixel.com/206/376/nature/
10;LA DE CAMINO;Magni nihil nostrum qui. Vel magnam quis corrupti. Voluptatem cupiditate nihil perspiciatis doloribus.;http://lorempixel.com/253/260/nature/
11;FRONTERA ESPARRAGAL VERDE;Illo molestias dolore nostrum aut iusto ea et. Ut nostrum facere eveniet eos.;http://lorempixel.com/300/279/nature/
12;LA FUENTES MENACHA;Ipsam laudantium vitae ab eum laboriosam aspernatur.;http://lorempixel.com/380/265/nature/
13;LAS GETARES DE;Unde assumenda nisi eligendi autem dolores modi. Quasi labore nesciunt assumenda.;http://lorempixel.com/253/384/nature/
14;ROCHE HONDO RÍO;Repellendus laudantium deserunt quibusdam. Ratione maiores ipsam. Consectetur voluptatibus alias molestias perspiciatis.;http://lorempixel.com/294/305/nature/
15;DE EL CAMINOS;Saepe nisi commodi odio quisquam reiciendis deserunt.;http://lorempixel.com/245/388/nature/
16;RETÍN DEL LA;Id perferendis vel autem iste rerum. Aliquam quis nobis exercitationem dolore et labore.;http://lorempixel.com/376/273/nature/
17;OJO DEL VICOS;Nihil ut similique magni.;http://lorempixel.com/328/308/nature/
18;EL CARRASCÓN SALTADERO;Vel optio error eligendi. Nemo mollitia dolores totam iusto. Quis debitis libero.;http://lorempixel.com/223/336/nature/
19;LA LA FRONTERA;Alias beatae adipisci corrupti deleniti doloribus sunt. Illum doloribus nihil atque aliquid pariatur.;http://lorempixel.com/225/280/nature/
20;DEL DE ARROYO;Similique harum dolores adipisci ut. Fugiat maiores voluptate maiores. Impedit labore voluptatem deserunt quos unde. Mollitia eligendi reprehenderit fugiat laborum.;http://lorempixel.com/239/361/nature/
21;DE FRONTERA-CANTARRANAS PEDRIZA;Unde ullam necessitatibus ducimus facilis distinctio quos. Maiores aspernatur deleniti ratione debitis nesciunt cumque quisquam. Nam aliquid ducimus praesentium sequi.;http://lorempixel.com/331/314/nature/
22;CARBONEROS GUADALMESÍ SALINA;Quae cupiditate sunt ducimus velit ex. Aut accusantium totam ipsam aliquid quam vero cumque. Pariatur quos maiores odit.;http://lorempixel.com/299/234/nature/
23;DE ESPERA CALAS;Totam eum soluta molestias adipisci sapiente delectus laudantium.;http://lorempixel.com/276/388/nature/
24;LOS PALMONES DEL;Debitis adipisci quos quas. Quibusdam ad eaque deleniti consequatur. Unde fugit corrupti ipsum ducimus molestiae voluptate.;http://lorempixel.com/299/372/nature/
25;ALBARRACINEJO CERRO DE;Ducimus reprehenderit culpa accusantium occaecati explicabo veritatis. Cumque accusantium qui nostrum eum vel error.;http://lorempixel.com/226/382/nature/
26;MECA DE CABO;Cupiditate in dicta illo. Voluptatibus quisquam illo autem voluptatibus.;http://lorempixel.com/313/388/nature/
27;ANTÓN DE SAN;Ab facere id. Nostrum dolore eligendi. Magni asperiores nulla dolorem rem.;http://lorempixel.com/345/312/nature/
28;- DEL -;Aliquid repellendus veniam corporis. Fugiat esse eum fugiat illum.;http://lorempixel.com/225/297/nature/
29;DE DEL CERRO;Dicta non earum quasi assumenda omnis. Delectus voluptatem eaque nostrum inventore.;http://lorempixel.com/301/250/nature/
30;DE LAS JUDÍO;Repellat iusto pariatur doloremque quo.;http://lorempixel.com/242/252/nature/
31;MONTERA DEL LA;Pariatur at laudantium ullam. Ratione culpa porro soluta voluptatum.;http://lorempixel.com/343/379/nature/
32;RUTA DE BANDOLEROS;Iure officia sapiente porro occaecati suscipit reiciendis.;http://lorempixel.com/225/349/nature/
33;UBRIQUE LA CRUZ;Explicabo ducimus vitae unde fugiat necessitatibus. Explicabo rem soluta odit harum.;http://lorempixel.com/226/353/nature/
34;LAS TEJÓN CANTERAS;In impedit debitis repellendus vitae fugiat laborum quos. Alias saepe delectus similique. Cum rerum fuga consequuntur consequuntur.;http://lorempixel.com/212/362/nature/
35;PUERTA DEL VERDE;Hic inventore officiis explicabo deleniti at. Sequi molestiae accusantium sapiente reiciendis soluta fuga.;http://lorempixel.com/293/265/nature/
36;UBRIQUE DE ASOMADILLA;Voluptatum quidem at doloribus sed laudantium hic culpa. Incidunt cupiditate eaque quo dolor cupiditate quas.;http://lorempixel.com/338/217/nature/
37;SALTILLO ROCHE EL;Harum deserunt voluptatibus at praesentium. Doloribus officia repellat repudiandae at numquam et. At aliquid ullam atque neque voluptatem cumque.;http://lorempixel.com/256/314/nature/
38;Y SANTO EL;Magni deleniti temporibus explicabo adipisci laboriosam eos. Reiciendis maiores magni vitae ex iste.;http://lorempixel.com/294/324/nature/
39;DEL COLADA BOSQUE-CAMINO;Doloribus optio consectetur et alias. Sed ea commodi dolor. Corrupti doloremque assumenda cum fugiat assumenda illo atque.;http://lorempixel.com/305/200/nature/
40;PRESA DE BOGAS;Cumque quia qui explicabo veniam deleniti veniam minima. Corporis cupiditate ab voluptatum. Illo nisi voluptatibus tenetur illum vero recusandae.;http://lorempixel.com/327/307/nature/
41;LOS CAMINO DE;Tenetur magnam nam dolores laboriosam. Distinctio aliquam iste fuga neque aspernatur. Eum error harum sapiente amet.;http://lorempixel.com/349/397/nature/
42;DEL JEREZ LA;Excepturi aperiam dicta reiciendis tenetur. Omnis debitis ducimus dolores eaque dignissimos. Voluptatem deserunt consequuntur deleniti ipsa harum.;http://lorempixel.com/337/264/nature/
43;GUADALETE DEL CAMARINAL;Quo officiis rem neque. Animi ad sapiente nesciunt.;http://lorempixel.com/322/257/nature/
44;LAS DESCANSADERO DEL;Aspernatur saepe asperiores impedit aspernatur nostrum odit. Vel sit laudantium ea nesciunt. Fugiat mollitia delectus deleniti ut optio necessitatibus delectus.;http://lorempixel.com/389/206/nature/
45;PLAZA LA ALGECIRAS;Tenetur voluptatibus hic natus fugiat.;http://lorempixel.com/246/303/nature/
46;DEL GUADIARO ESTUARIO;Tenetur aspernatur occaecati repellendus necessitatibus. Animi fuga nihil nesciunt itaque quidem iusto.;http://lorempixel.com/245/211/nature/
47;GARGANTA PUERTO OSCURO;Ullam enim libero porro voluptatem. Eaque aut deleniti accusamus necessitatibus laboriosam sunt.;http://lorempixel.com/258/277/nature/
48;DEL RAYO -;Quam repellat esse est eum rerum eveniet. Fuga libero fugit ipsam nam. Odit officiis modi nostrum nihil.;http://lorempixel.com/249/239/nature/
49;DE CAMINOS LOMAS;Nulla nam repellendus in. Similique consequatur atque illum. Quidem nulla totam impedit.;http://lorempixel.com/271/242/nature/
50;EMBALSE DE BORNOS;Neque qui laboriosam voluptas deserunt minima sunt iure. Dolorum iste mollitia minus.;http://lorempixel.com/272/236/nature/
51;BORNOS DEL DE;Inventore dolorem illo dolorem sunt id molestias. Suscipit dignissimos tempore.;http://lorempixel.com/381/202/nature/
52;LA DE MEDINA;Culpa incidunt ducimus quidem temporibus. Modi soluta earum blanditiis eaque accusamus.;http://lorempixel.com/327/249/nature/
53;PRESA DEL GUADALMESÍ;Perferendis suscipit similique odio. Nobis vitae quod tenetur.;http://lorempixel.com/349/202/nature/
54;BACINETE ARROYOMOLINOS DEL;Et cum nam dolorem maiores totam. Quisquam mollitia repudiandae inventore ipsam ipsum nesciunt commodi. Harum iste deleniti ea.;http://lorempixel.com/317/307/nature/
55;AL COVEZUELAS-CHARCA CERRO;Officiis itaque earum iusto hic. Incidunt voluptatibus corporis pariatur repudiandae. Esse sint fugiat totam officiis suscipit.;http://lorempixel.com/252/367/nature/
56;BENAJIMA DE ROCINEJO;Voluptatum velit tenetur tenetur doloremque ex culpa. Inventore velit modi voluptas repellendus.;http://lorempixel.com/399/207/nature/
57;DE COMPLEJO DE;Molestias alias praesentium dicta.;http://lorempixel.com/240/211/nature/
58;ROQUE PLAYA DE;Nulla minima assumenda fugit. Asperiores veniam eos aliquid perspiciatis beatae. Quasi amet maiores reprehenderit ut.;http://lorempixel.com/378/235/nature/
59;CONIL LA ATALAYA;Libero omnis delectus a impedit libero. Consectetur veritatis dolore alias facilis ea.;http://lorempixel.com/369/232/nature/
60;TIEMPO PUERTO UN;Error et illo sint voluptate vero. Id necessitatibus nobis placeat harum assumenda. Architecto deleniti placeat possimus impedit nulla ipsam.;http://lorempixel.com/229/380/nature/
61;BATANES RETÍN Y;Vero porro explicabo soluta a molestias libero. Voluptatibus officia illum perspiciatis.;http://lorempixel.com/218/204/nature/
62;SUBIDA AL PICO;Quis omnis quo aliquid laborum. Quos velit voluptatum aperiam cumque. Enim inventore aliquam sequi sed.;http://lorempixel.com/343/316/nature/
63;DEL DE RAYO;Ducimus ipsam accusamus saepe accusantium corporis molestiae aut. Reiciendis nemo ex repudiandae. Dolore quis nobis.;http://lorempixel.com/363/214/nature/
64;BENALUP-FACINAS VERDE BORNOS;Accusantium in voluptatibus perferendis dolores. Minima ratione sapiente sequi fuga maxime soluta.;http://lorempixel.com/274/228/nature/
65;DEL VERDE PARQUE;Vitae ullam numquam nemo minima voluptatem numquam. Quidem eveniet dicta eligendi magni dignissimos vitae. Nulla deleniti tempora ipsum cum nam voluptatibus.;http://lorempixel.com/234/380/nature/
66;LA TEJA DE;Mollitia sint laborum assumenda sequi vel assumenda quod.;http://lorempixel.com/350/361/nature/
67;DE LA CONIL;Tempore possimus quae quo sit. Libero maiores cupiditate aspernatur in dolore quibusdam.;http://lorempixel.com/385/289/nature/
68;DEL RURALES PALMONES;Similique pariatur vero. Optio dolore amet debitis.;http://lorempixel.com/231/354/nature/
69;A EL SANTOS;Ratione adipisci perspiciatis.;http://lorempixel.com/332/302/nature/
70;PLATERAS FUENTES LAS;Doloremque blanditiis deserunt iure perferendis quia aut doloribus.;http://lorempixel.com/393/268/nature/
71;DE ROCHE DE;Officia ex explicabo alias dolor veritatis. Necessitatibus consequuntur delectus ut adipisci saepe.;http://lorempixel.com/302/202/nature/
72;DEL CABRERO ALTO;Atque nobis sunt animi fugiat natus voluptate. Atque deserunt perspiciatis a. Voluptatum inventore ut iusto.;http://lorempixel.com/396/304/nature/
73;FIGURAS DE TAJO;Nesciunt molestias voluptate vero minus quo alias.;http://lorempixel.com/392/339/nature/
74;OSCURO PUERTO HONDÓN;Cum dolor expedita reiciendis molestias.;http://lorempixel.com/342/320/nature/
75;DE CÁDIZ ZAFRAMAGÓN;Corrupti illo reprehenderit optio. Consectetur eligendi rem repellendus inventore dolorum. Nemo non blanditiis a. Iusto quaerat nostrum itaque rerum reprehenderit consequuntur.;http://lorempixel.com/396/288/nature/
76;DE CERRO GARCIAGO;Numquam similique vel voluptatum. Beatae ipsum pariatur nemo doloribus sapiente vitae recusandae.;http://lorempixel.com/368/287/nature/
77;MECA DE LA;Pariatur commodi ad aliquid fuga. Nobis earum dolore debitis quibusdam reprehenderit. Repellendus officiis nobis atque non. Dicta dolores accusantium minus ab similique.;http://lorempixel.com/366/227/nature/
78;DE BARBATE TESORILLO;In doloribus deserunt. Deleniti unde vero nemo molestias deleniti. Ab numquam adipisci eaque eos placeat vitae.;http://lorempixel.com/390/380/nature/
79;DE JIMENA DE;Saepe pariatur facilis ullam minima.;http://lorempixel.com/326/266/nature/
80;DE CHARCONES ARROYO;Eligendi itaque consectetur alias reprehenderit harum inventore illo. Placeat tenetur vitae suscipit magnam.;http://lorempixel.com/293/327/nature/
81;PINOS ALGAIDA LOS;Perspiciatis illo error officiis doloremque quia minus molestiae. Asperiores possimus vitae assumenda pariatur reprehenderit.;http://lorempixel.com/381/352/nature/
82;CARRASCÓN CHAVARRIA EL;Consequatur adipisci excepturi quia expedita ullam perferendis. Aperiam libero vero nisi odit odio nostrum.;http://lorempixel.com/283/277/nature/
83;LADERA GUADALMESÍ RÍO;Quia temporibus ex nobis nam. Culpa totam delectus perspiciatis.;http://lorempixel.com/204/203/nature/
84;CAÑADAS EL DE;Vitae qui suscipit. Mollitia magni tempora repudiandae nulla consequatur. Similique exercitationem esse.;http://lorempixel.com/204/233/nature/
85;PUERTO DE GARGANTA;Eos veniam nisi excepturi amet at distinctio natus.;http://lorempixel.com/206/313/nature/
86;MONTE ALGAIDA AL;Nam ullam quam laborum fugit. Aliquam error sapiente.;http://lorempixel.com/399/357/nature/
87;DE ARCOS DEL;Rem velit inventore ad voluptates. Aperiam velit neque odit dolorem magnam sapiente.;http://lorempixel.com/340/274/nature/
88;DE AL BARBATE-ERMITA;Consectetur sequi corrupti aperiam esse ullam alias. Animi itaque id et voluptates sed laboriosam ab. Hic nam tempora dolor ipsum facere.;http://lorempixel.com/346/284/nature/
89;FATES SIERRA VERDE;Minima nesciunt incidunt dolorem. Quod quasi deleniti ipsa repellat. Voluptatem illo sequi nesciunt expedita.;http://lorempixel.com/364/302/nature/
90;DE ACANTILADO LÍBAR;Incidunt quibusdam sequi quaerat. Blanditiis soluta consequatur doloribus exercitationem corporis atque. Aperiam molestias aspernatur nemo ratione consectetur. Corporis repellat exercitationem repellat officia.;http://lorempixel.com/315/391/nature/
91;LLANOS DEL BERRAL;Nobis perferendis non ea praesentium. Sint aperiam deleniti eum totam doloremque. Perferendis earum a.;http://lorempixel.com/292/396/nature/
92;LA DE DE;Repudiandae nemo ipsum vel suscipit omnis corporis voluptas. Eligendi sed pariatur repellendus laborum laboriosam error.;http://lorempixel.com/270/224/nature/
93;DEL DE FERNANDO;Fuga placeat culpa et voluptate earum. Animi numquam tempora veniam et est ut.;http://lorempixel.com/250/328/nature/
94;Y TAJILLO ALBINA;Maiores numquam suscipit recusandae. Sit id nam rem.;http://lorempixel.com/301/317/nature/
95;RÍO MIEL DE;Tempora officiis illum quae. Corporis dolore repellendus est quia eaque repudiandae. Dicta natus quis enim consequatur iure molestiae.;http://lorempixel.com/355/221/nature/
96;LECHE DE LOS;Totam quod ullam eveniet.;http://lorempixel.com/296/356/nature/
97;DE DEL BOYAR;Similique suscipit eos odio.;http://lorempixel.com/211/364/nature/
98;RABEL LLANO SUARA;Consequatur ad ab deleniti quo voluptate laudantium. Omnis aut quidem dolor corporis similique. Delectus nam officiis quasi. Consequatur sed harum maiores.;http://lorempixel.com/272/224/nature/
99;MECA MOLINO CALLEJÓN;Provident non repudiandae. Dolorem accusantium minus aperiam veritatis cum. Sunt voluptates error veniam fuga.;http://lorempixel.com/272/373/nature/
100;LA ARROYO GARGANTA;Non eum illum nam illum quisquam tenetur.;http://lorempixel.com/385/374/nature/
101;DE PUERTA DE;Exercitationem incidunt debitis amet doloribus. Tempore necessitatibus dolorem consequuntur aliquid culpa. Officia molestias cupiditate quos tempora porro.;http://lorempixel.com/295/306/nature/
102;CABRERO RIO DEL;Exercitationem ratione explicabo enim fugit illum similique. Iure adipisci ratione aperiam cupiditate. Sapiente saepe accusantium eius minus. Repudiandae doloremque eligendi sequi cumque.;http://lorempixel.com/352/330/nature/
103;VEGA DE GUADIARO;Ea magni dicta maxime vitae iusto. Eligendi vero ipsam quod distinctio.;http://lorempixel.com/203/210/nature/
104;DE SIERRA LIJAR;Ab voluptatum repellendus saepe. Placeat praesentium inventore adipisci ipsum officiis deleniti. Voluptatem veniam illo nostrum blanditiis. Dolorum suscipit eveniet provident id libero repellendus.;http://lorempixel.com/330/391/nature/
105;MATAGORDA DEL HONDÓN;Cum optio necessitatibus.;http://lorempixel.com/375/217/nature/
106;ESPERANZA PESCADORES LOS;Neque sequi vero nisi saepe accusamus. Perspiciatis mollitia error repellendus perferendis quaerat.;http://lorempixel.com/332/325/nature/
107;VENTAS TRASHUMANTES SUARA;Quod reprehenderit voluptatum cumque delectus.;http://lorempixel.com/213/380/nature/
108;FRONTERIZO LOS TORUÑOS;Atque occaecati cum ipsum exercitationem numquam. Assumenda beatae molestiae. Et dolore consequuntur iste. Harum excepturi officiis excepturi neque veniam veritatis.;http://lorempixel.com/309/351/nature/
109;LA MONTECOCHE SALINA;Unde quibusdam ipsa quis eligendi. Odit ipsa vel quos.;http://lorempixel.com/200/276/nature/
110;PICACHO AURELIA AL;Necessitatibus praesentium minima qui.;http://lorempixel.com/237/397/nature/
111;DORNAJO DEL CASA;Animi cum temporibus libero repudiandae.;http://lorempixel.com/293/370/nature/
112;HONDÓN SERRANO AL;Culpa molestiae itaque dolores ut illum iusto. Quos ut incidunt molestias. Officia numquam possimus odit culpa ducimus.;http://lorempixel.com/366/333/nature/
113;DEL DEL VIAJERO;Nemo quaerat voluptatibus quae adipisci porro. Non animi iusto. Non inventore suscipit laborum mollitia doloremque animi.;http://lorempixel.com/393/345/nature/
114;LOS DE CASA;Ab et voluptate consequuntur rerum porro animi. Eligendi dolor repudiandae modi.;http://lorempixel.com/200/229/nature/
115;REAL CAÑADA DE;Error consequuntur velit tempore perferendis enim.;http://lorempixel.com/248/327/nature/
116;DE LA LOS;Deleniti molestiae culpa vitae iusto. Veritatis maiores dolorem vitae minus. Hic reprehenderit repellat. Voluptas deleniti minima sapiente nostrum alias veniam exercitationem.;http://lorempixel.com/230/364/nature/
117;DE CORDERO REAL;Vel reprehenderit numquam necessitatibus inventore. Porro assumenda saepe rem illo harum enim tempora.;http://lorempixel.com/314/375/nature/
118;MORITA TORRE DE;Temporibus tempora suscipit consectetur. A cupiditate excepturi nam. Adipisci esse suscipit accusamus molestias tempora.;http://lorempixel.com/309/352/nature/
119;DEL DE DEHESA;Quasi sint fugit eius officia consectetur maxime.;http://lorempixel.com/397/223/nature/
120;RURALES TORVISCALEJO-NACIMIENTO DE;Maiores natus non numquam. Quidem autem fugit placeat. Tempora ullam ad ex.;http://lorempixel.com/393/224/nature/
121;LOS TAVIZNA-EMBALSE DE;Eos veniam dolores vero sequi.;http://lorempixel.com/229/271/nature/
122;SALINA-FANGOS MAREALES JANDA;Eveniet recusandae recusandae ratione voluptate distinctio. Corporis laudantium minus voluptatibus saepe.;http://lorempixel.com/351/315/nature/
123;LA PAJARRACO PLAZA;Nisi nesciunt natus eos ipsa. Labore pariatur blanditiis odit culpa.;http://lorempixel.com/214/362/nature/
124;SAN AMBROSIO DE;Quae illo aut quam quas placeat exercitationem. Esse consectetur aliquam porro totam nemo. Ab maiores ipsam blanditiis.;http://lorempixel.com/393/257/nature/
125;LOS CAMINO DE;Mollitia est corrupti doloribus voluptates molestias atque quos. Aspernatur hic beatae quasi assumenda magnam distinctio. Cumque enim reiciendis corrupti eligendi quod tempora.;http://lorempixel.com/298/207/nature/
126;GANADERAS CANALIZO DE;Velit occaecati quae ab dolorum. Error error dolorum similique sit provident.;http://lorempixel.com/225/258/nature/
127;EMBALSE ARCOS DE;Hic suscipit atque temporibus. Excepturi rem quis. Perferendis qui voluptas sint quam a.;http://lorempixel.com/266/237/nature/
128;ALGAIDA DE LA;Nam fugiat illo sed vitae exercitationem earum accusantium. At dolorum porro necessitatibus consequuntur deserunt necessitatibus.;http://lorempixel.com/344/217/nature/
129;DEL - BUJEO;Maxime consectetur consequatur quasi dicta. Reprehenderit ratione nam.;http://lorempixel.com/338/357/nature/
130;DE LA BARBATE;Nam blanditiis ex. Quasi velit dolore excepturi. In quos laboriosam quisquam cupiditate nemo eius.;http://lorempixel.com/218/379/nature/
131;VERDE LA SANLÚCAR;Officia eius debitis velit. Minus explicabo pariatur corrupti vero alias.;http://lorempixel.com/336/348/nature/
132;DEL DE RIBERA;Modi eos iusto magni ipsa eius alias. Nesciunt laudantium nemo neque atque.;http://lorempixel.com/311/393/nature/
133;ENDRINAL DEL DE;Temporibus vitae quibusdam. Consequuntur illo aut voluptate maxime corporis. Debitis repellendus iusto architecto necessitatibus.;http://lorempixel.com/244/286/nature/
134;LOS SUARA DE;Velit ea fugiat doloremque reprehenderit enim. Tempora harum quos nulla modi. Asperiores non sed sapiente necessitatibus maxime in vero.;http://lorempixel.com/355/282/nature/
135;TRAVESIA DEL ALJIBE;Eius quisquam animi et ipsum pariatur voluptates laborum. A ab maiores consequatur pariatur. A modi amet dolores dolorum provident error.;http://lorempixel.com/210/388/nature/
136;LA LA CABRAS;Eveniet corporis facilis laboriosam. Repellendus sunt cupiditate quasi rem in.;http://lorempixel.com/236/325/nature/
137;ALBINAS DE LOS;Eum porro exercitationem et aliquid sint. Reprehenderit reprehenderit repellat architecto.;http://lorempixel.com/325/258/nature/
138;CHARCONES LOS DE;Eum pariatur dolorem porro dolorum. Neque debitis et odio. Voluptatem nulla saepe nihil.;http://lorempixel.com/337/317/nature/
139;RATONES LOS REAL;Ducimus dignissimos iusto corporis temporibus libero. Ex alias modi blanditiis. Corrupti ut ipsam.;http://lorempixel.com/208/320/nature/
140;DE ROMANOS DEL;Ex molestiae tenetur expedita. Minima ducimus ad odio. Quas officiis tempore vel nemo harum eos vitae. Nam iusto cumque impedit facere delectus eius deleniti.;http://lorempixel.com/318/244/nature/
141;DEL TIRADERO DE;Est enim unde architecto. Libero sapiente nesciunt laudantium consequatur quis.;http://lorempixel.com/206/277/nature/
142;LA SERRANO DE;Omnis quibusdam tenetur ipsum. Harum dolor magni deserunt iure. Nisi culpa doloribus illo dicta.;http://lorempixel.com/264/397/nature/
143;RAMOS DE ASOMADA;A unde laborum facilis. Dolorum excepturi quisquam praesentium est laudantium.;http://lorempixel.com/278/201/nature/
144;SAN ARROYO TIRADERO;Quasi hic alias eveniet. Omnis sed aspernatur tempore et illum. Minima temporibus accusamus ipsum.;http://lorempixel.com/212/384/nature/
145;REMEDIOS MILLAN GARGANTA;Ipsa ullam reprehenderit nihil. Ab laborum ad consequatur magni animi. Rem labore vel nisi beatae cum doloribus saepe.;http://lorempixel.com/231/203/nature/
146;JIMENA DE MAJACEITE;Eveniet excepturi expedita esse unde. Illum eius nobis itaque.;http://lorempixel.com/339/227/nature/
147;EMBALSE DEL BARBATE;Impedit velit commodi. Numquam dolorum illo libero omnis eum. Id rem numquam.;http://lorempixel.com/322/257/nature/
148;ARROYO ATUNES-ATLANTERRA CANUTO;Sapiente quam nesciunt perspiciatis. Sunt ipsum modi ratione beatae magni. Ipsum ab iure fugiat illo sed tenetur.;http://lorempixel.com/301/232/nature/
149;PAJARRACO LA BODEGA;Dolor reiciendis quae occaecati natus. Porro soluta deserunt iusto omnis tenetur.;http://lorempixel.com/386/215/nature/
150;DEL COLA GUAREÑAS;Minus culpa voluptatem non consequatur. Quos totam perspiciatis autem consectetur consectetur sapiente. Earum voluptas illum possimus.;http://lorempixel.com/241/299/nature/
151;LAS DEL SALINAS;Id consequuntur eligendi repellendus. Maxime unde libero. Corporis tempore inventore aliquid.;http://lorempixel.com/250/205/nature/
152;DE GRAZALEMA ALGODONALES;Non adipisci quod cum. Nemo accusantium ducimus facere error vero. Earum ut placeat. Atque ut dolorum magnam ducimus nisi quibusdam.;http://lorempixel.com/372/366/nature/
153;DE CERRO SUBIDA;Odit hic similique impedit porro laudantium quae. Iure similique quidem error dolorum aperiam ea. Et qui expedita qui.;http://lorempixel.com/233/294/nature/
154;DE LOMAS RURALES;Maxime soluta culpa perferendis temporibus ipsum ratione. Explicabo tenetur odit recusandae. Corporis voluptas rerum sed consectetur.;http://lorempixel.com/279/326/nature/
155;LOS REMEDIOS JARILLO-TORRE;Nulla iste dolorem suscipit. Necessitatibus veniam nulla placeat illum dolorum aspernatur praesentium. Doloremque dolor excepturi corrupti molestiae.;http://lorempixel.com/251/227/nature/
156;CHICLANA REMEDIOS DE;Quos eaque laborum nam beatae praesentium nemo ab. Amet aut doloribus commodi. Corrupti laboriosam reprehenderit quaerat quam vero possimus. Sint corporis corrupti libero modi quibusdam amet.;http://lorempixel.com/283/256/nature/
157;DE PUERTO DE;Aspernatur veniam perferendis. Molestias minus autem unde delectus pariatur natus fuga. Beatae accusamus quibusdam perferendis doloribus accusantium repellat. Accusantium architecto non est.;http://lorempixel.com/237/280/nature/
158;LA DE DE;Ab est tempora repudiandae facere consequatur. Est minima numquam in totam necessitatibus.;http://lorempixel.com/310/313/nature/
159;Y FUENTE BREÑA;Ad facilis odit consequuntur consectetur. Dolor perspiciatis omnis rerum architecto nulla consequatur sequi. Ratione molestias veniam doloribus adipisci numquam nostrum nesciunt.;http://lorempixel.com/360/268/nature/
160;LA EMBALSE DEL;Sed nam occaecati soluta laborum provident. Culpa qui quae vero porro consectetur.;http://lorempixel.com/287/249/nature/
